RID,UPA #,Estab Name,DBA,Site Address 1,Site Address 2,Site City,Site State,Site Zip,Site County,Primary/Site NAICS,UPA Receipt Date,Receipt Type,Formality,Insp #,Hazard Desc & Location,# Alleged Hazards/ Emp Exposed
111400,C-1558397,Amazon,,1000 Technology Center Drive,,STOUGHTON,MA,02072,NORFOLK,425120 / 425120,2020-03-25 13:00:00,Phone,Nonformal,,Warehouse: Employer is not enforcing protocols in place to keep employees 6 feet apart. Protocols are not being provided in all languages spoken by employees. Personal protective equipment is not being provided to employees. Equipment is not easily accessible from safety team members who may not be in the work area. ,3 /50
111400,C-1558908,Amazon,,500 Sprague Street,,DEDHAM,MA,02026,NORFOLK,493110 / 493110,2020-03-26 08:00:00,Phone,Nonformal,,Employees are going into work sick. Employer is encouraging these employees to come to work. Employer has not provided hand sanitizers and products to clean workplace surface. Safety procedures to limit exposure to COVID 19 have not been implemented. ,2 /50
111400,C-1562518,Amazon,,500 Sprague Street,,DEDHAM,MA,02026,NORFOLK,493110 / 493110,2020-03-31 11:30:00,Phone,Nonformal,,Employees are having to go into work sick with respiratory problems because they do not have sick time. Employees were told several weeks ago that masks would be available. There are presently no masks to help prevent sick people from getting coworkers sick with a respiratory illness that could be COVID19 . Handwashing is being limited The amount of glove changes is being limited. ,5 /20
111400,C-1569297,Amazon,,500 Sprague Street,,DEDHAM,MA,02026,NORFOLK,493110 / 493110,2020-04-10 08:00:00,Online,Nonformal,,Employees were possibly exposed to COVID19 after there was a reported case of COVID19 in the work place. The facility is not shutting down to ensure all work areas have been disinfected and there is no potential for live virus on surfaces.,2 /50
111400,C-1575644,Amazon BOS5,,1000 Technology Center Drive,,STOUGHTON,MA,02072,NORFOLK,425120 / 425120,2020-04-21 13:00:00,Phone,Nonformal,,"1. No soap; 2. No sanitizer 3. Due to the nature of the work, employees are unable to distance. Employer has not provided alternate measure to protect employees. 4. Employer has not provided follow-up care and information (in accordance with HIPPA and local and state health authorities) to employees whose co-workers have become ill from COVID. Employees are concerned that the employer is ¿hiding¿ COVID-positive cases from employees. ",4 /100
111400,C-1588674,Amazon,,1000 Technology Center Drive,,STOUGHTON,MA,02072,NORFOLK,425120 / 425120,2020-05-13 13:00:00,Phone,Nonformal,,"Employees who are required to wear masks for 8 hour shifts are not given opportunities to take short breaks from the wearing masks. If an employee removes masks for a moment (ensuring they are 6 feet away from a coworker) to catch their breath and get some relief, they are reprimanded. Employees are experiencing feelings of respiratory distress while wearing mask for extended periods of time. ",2 /100
111400,C-1595150,Amazon Logistics,,480 Sprague St.,,DEDHAM,MA,02026,NORFOLK,541614 / 541614,2020-05-26 08:30:00,Online,Nonformal,,"1.) Handheld device and palm scanners not cleaned or disinfected between shifts, neoprene device armbands, which are frequently in direct contact with skin are not cleaned or disinfected (if even possible) between shifts; armbands are sometimes even sweaty from previous user.",1 /25
111400,C-1630669,Amazon,,351 Maple Street,,BELLINGHAM,MA,02019,NORFOLK,454390 / 454390,2020-07-27 09:15:00,Online,Nonformal,,1. Employees at Amazon still continue to not properly wear their masks or not at all.,1 /100
111500,C-1564827,Amazon Fulfillment Center BDL-3,,409 Washington Avenue,,NORTH HAVEN,CT,06473,NEW HAVEN,492110 / 492110,2020-04-02 15:00:00,Phone,Nonformal,,Workers are not told in a timely manner about coworkers who have tested positive for COVID-19 and increases in surface disinfection practices have not been performed.,1 /120
111500,C-1584881,Amazon BDL3,,409 Washington Avenue,,NORTH HAVEN,CT,06473,NEW HAVEN,518210 / 518210,2020-05-06 16:15:00,Phone,Nonformal,,"1. Allegedly, employees tested positive for coronavirus (COVID-19) and the employer has not informed employee who are on extended leave of absence on the amounts of employees who had contacted coronavirus in the past month and had not taken any preventative measures in accordance with CDC Guidelines for employees indirect or direct exposed to individuals with known or suspected cases of coronavirus (COVID-19). 2. Allegedly, outside contractors performing cleaning and disinfecting of the workshop are not provided with appropriate personal protective equipment (PPE) and are not maintaining social distancing with the Amazon employees. ",2 /1000
112000,C-1588404,Amazon - Fulfillment Center,,200 Old Iron Ore Road,,WINDSOR,CT,06095,HARTFORD,454111 / 454111,2020-05-13 08:00:00,Email,Nonformal,,This facility isn't following social distancing protocols. Masks are suppose to be mandatory but most employees aren't wearing them. Management are not dealing with anyone not following Covid 19 protocols.,1 /1
112000,C-1683129,Amazon Delivery Station,,65 Holmes Rd,,NEWINGTON,CT,06111,HARTFORD,492110 / 492110,2020-11-03 16:20:00,Phone,Nonformal,,"Employees may be exposed to COVID-19 in that, mask wearing is not enforced",1 /20
112000,C-1703953,Amazon - Fulfillment Center,,200 Old Iron Ore Road,,WINDSOR,CT,06095,HARTFORD,454111 / 454111,2020-12-11 09:15:00,Phone,Nonformal,,"Packing Department: Although compliance has gotten better, employees are still not wearing masks properly. Employees must work in close proximity to each other and there have been up to ten messages a day notifying employees of team member infected with COVID-19 within the facility.",1 /100
112300,C-1552588,Amazon Whole Foods Shoppers,,261 Waterman Street,,PROVIDENCE,RI,02906,PROVIDENCE,445110 / 445110,2020-03-12 23:30:00,Online,Nonformal,,"Employees do not have access to disposable gloves when picking and handling produce and raw meats for customers. These gloves were available until March 11, 2020. The employer is now requiring employees to insert their hands into plastic produce bags as a substitute, or wear no gloves at all. These produce bags do not offer adequate protection to workers against contamination. ",1 /20
112300,C-1570046,DRI1 Amazon Delivery Center,,115 Dupont Dr.,,PROVIDENCE,RI,02907,PROVIDENCE,492210 / 492210,2020-04-13 09:24:00,Email,Nonformal,,"An Amazon delivery driver tested positive for covid-19 and was inside the warehouse on 4/08/2020, and workers are still being told to continue working with no actions being taken.",1 /30
112300,C-1622213,"Amazon Logistics, Inc.",,115 DUPONT DRIVE,,PROVIDENCE,RI,02907,PROVIDENCE,485999 / 485999,2020-07-14 13:45:00,Phone,Nonformal,,1. Management is not following the 6 foot distancing guidelines and mask wearing policy for Covid-19. 2. An employee passed out from the heat and management did not follow protocol to prevent heat illness or take care of the employee when she fell ill.,2 /100
134000,C-1567857,Amazon Robotics LLC,,300 Riverpark Dr.,,NORTH READING,MA,01864,MIDDLESEX,541614 / 541614,2020-04-08 11:00:00,Phone,Nonformal,,The employer is not enforcing CDC guidelines to protect employees from Covid-19. Guidelines are provided on the CDC website at: https://www.cdc.gov/coronavirus/2019-ncov/community/guidance-business-response.html?CDC_AA_refVal=https%3A%2F%2Fwww.cdc.gov%2Fcoronavirus%2F2019-ncov%2Fspecific-groups%2Fguidance-business-response.html Employer is not complying with the recommended social distancing of employees. Employer is not enforcing PPE use when employees are working in close proximity. Employer is not employee when a co-worker tests positive. Employer is not providing training to employees about how to reduce the spread of Covid-19. ,3 /70
134000,C-1577725,Amazon Robotics LLC,,300 Riverpark Dr.,,NORTH READING,MA,01864,MIDDLESEX,541614 / 541614,2020-04-22 14:39:00,Phone,Nonformal,,"1. Employees are not receiving general, non-identifying communication from the employer when they may have come in contact or worked in an area with an employee who has confirmed COVID-19. ",1 /1
134000,C-1580749,Amazon Robotics LLC,,300 Riverpark Dr.,,NORTH READING,MA,01864,MIDDLESEX,541614 / 541614,2020-04-29 13:30:00,Online,Nonformal,,The employer is not following the CDC guidelines in regards to: Communicating to all employees when an fellow employee contracts Covid-19 virus.,1 /100
134000,C-1696451,Amazon Fresh,,2151 Mystic Valley Pkwy,,MEDFORD,MA,02155,MIDDLESEX,445110 / 445110,2020-12-01 08:15:00,Phone,Nonformal,,1. The employer is not enforcing CDC guidelines to protect employees from COVID-19. Guidelines are provided on the CDC website at: https://www.cdc.gov/coronavirus/2019-ncov/community/guidance-business-response.html?CDC_AA_refVal=https%3A%2F%2Fwww.cdc.gov%2Fcoronavirus%2F2019-ncov%2Fspecific-groups%2Fguidance-business-response.html,1 /20
213100,C-1788523,Amazon FC,,635 International Blvd.,,ROCK TAVERN,NY,12575,ORANGE,493110 / 493110,2021-07-19 08:00:00,Hotline,Nonformal,,- Employees are being exposed to mold and not informing the employees of the exposure. They are being told by human resources it is an air-condition issue. - Not all employee are vaccinated for COVID.,2 /1
213400,C-1554433,"Amazon Fulfillment Services, Inc.",Amazon Fulfillment Center LGA9,2170 NJ Route 27,,EDISON,NJ,08817,MIDDLESEX,454110 / 454110,2020-03-17 14:00:00,Phone,Nonformal,,The company has stressed hand-washing for COVID19 precaution; but 4 different bathrooms were out of hand soap yesterday and hand wipes / sanitizer supplies were lacking. Managers simply say they are on back-order.,1 /2000
213400,C-1602141,"Amazon Fulfillment Services, Inc.",Amazon Fulfillment Center (LGA9),2170 NJ Route 27,smerrell@amazon.com,EDISON,NJ,08817,MIDDLESEX,454110 / 454110,2020-06-08 09:45:00,Online,Nonformal,,"Workers are potentially exposed to surfaces such as cardboard gaylord crates and plastic totes that are not sanitized on a frequent, periodic or even occasional basis. Contrary to the OSH Act of 1970, Section: 5 (a)(1).",1 /50
213400,C-1625508,Amazon TEB6,,22 Hightstown-Cranbury Staion Road,,CRANBURY,NJ,08512,MIDDLESEX,454113 / 454113,2020-07-20 08:00:00,Online,Nonformal,,1. Employees are exposed to health hazards associated with COVID-19. It was reported that work areas are not designed to be six feet apart and social distancing is not implemented in accordance with CDC guidelines. Contrary to Section 5(a)1 of the OSH Act.,1 /100
213400,C-1631933,"Amazon Fulfillment Services, Inc.",Amazon Fulfillment Center (LGA9),2170 Lincoln Hwy,,EDISON,NJ,08817,MIDDLESEX,454110 / 493110,2020-07-28 08:00:00,Phone,Nonformal,,1. Workers are exposed to health hazards and unsanitary conditions where a circumstance closed all restrooms in the facility with no remedy or process to allow sanitary and private washing and voiding. Contrary to 29 CFR 1910.141(c). 2. Workers are exposed to hazards from unsanitary conditions in that wash stations with tepid water are not available routine and frequent cleansing as necessary to protect workers from COVID-19. Contrary to 29 CFR 1910.141(d).,1 /2000
213400,C-1667118,Amazon Fulfillment Center # TEB6,,22 Highstown - Cranbury Station Road,,CRANBURY,NJ,08512,MIDDLESEX,452910 / 452910,2020-10-01 08:00:00,Phone,Nonformal,,"1) EE¿s and managers not wearing face masks or social distancing as per CDC guidance. 2) Facility not being cleaned/sanitized properly as per CDC guidance, nor are there supplies to do so. ************************ 3) Black particle debris in water. (Non COVID) Warehouse",3 /0
213900,C-1571605,Amazon,,2277 Center Square Road,,SWEDESBORO,NJ,08085,GLOUCESTER,454110 / 454110,2020-04-15 08:30:00,Hotline,Nonformal,,1. Employees are allegedly exposed to unhealthy work conditions when having to re-use gloves during the COVID-19 outbreak.,1 /500
213900,C-1578661,Amazon Fulfillment Services,,50 New Canton Way,,ROBBINSVILLE,NJ,08691,MERCER,454110 / 454110,2020-04-27 09:45:00,Phone,Nonformal,,- Employees are exposed to the COVID-19 virus. Your company did not prevent contamination and/or contact exposure with potentially infected associates by sanitizing common areas and not providing appropriate Personal Protective Equipment (PPE).,1 /100
213900,C-1592808,Amazon.com,Amazon Fulfillment Center,50 New Canton Way,,TRENTON,NJ,08691,BURLINGTON,454111 / 454111,2020-05-19 15:30:00,Hotline,Nonformal,,Employees are potentially exposed to health hazards from COVID-19: 1. Where the employer has not implemented effective measures for cleaning and disinfecting of the work area. 2. Where the employer has not provided effective masks or face coverings. 3. Where social distancing measures on the ASE line and in the break rooms are not being enforced.,3 /4500
213900,C-1609671,Amazon Fulfillment Center,,240 Mantua Grove Rd.,,WEST DEPTFORD,NJ,08066,GLOUCESTER,454110 / 454110,2020-06-23 08:00:00,Online,Nonformal,,"Employees are potentially exposed to health hazards from the workplace transmission of COVID-19: 1. Where employees presenting symptoms of illness, such as fever, are required to work in close proximity to others without further evaluation. [OSH Act Section 5(a)(1)] ",1 /0
213900,C-1632130,Amazon Fulfillment Center,,50 New Canton Way,,ROBBINSVILLE,NJ,08691,MERCER,454110 / 454110,2020-07-28 13:30:00,Online,Nonformal,,"1. Workers are exposed to contracting and spreading COVID-19 in that employees do not follow guidance regarding the proper wear of appropriate masks to cover the full breathing zone while working in areas where the cover is the only barrier among coworkers. Contrary to CDC guidance and the OSH Act of 1970, Section 5(a)(1). 2. Workers are exposed to contracting and spreading COVID-19 in that managers and supervisors are modeling the incorrect wearing of face covers, are not enforcing the wearing of masks, and do not correct workers who don the mask incorrectly. This is contrary to the OSH Act of 1970, Section 5(a)(1).",2 /2000
213900,C-1633780,Amazon Fulfillment Center,,240 Mantua Grove Rd.,,WEST DEPTFORD,NJ,08066,GLOUCESTER,454110 / 454110,2020-07-30 08:15:00,Online,Nonformal,,"1. Workers are exposed to contracting and spreading COVID-19 in that employees do not follow guidance regarding the proper wear of appropriate masks to cover the full breathing zone while working in areas where the cover is the only barrier among coworkers. Contrary to CDC guidance and the OSH Act of 1970, Section 5(a)(1). 2. Workers are exposed to contracting and spreading COVID-19 in that managers and supervisors are modeling the incorrect wearing of face covers, are not enforcing the wearing of masks, and do not correct workers who don the mask incorrectly. This is contrary to the OSH Act of 1970, Section 5(a)(1). Location: All of second and third floors.",2 /200
214200,C-1643872,Amazon FC,,940 Monroe St,,HOBOKEN,NJ,07030,HUDSON,423990 / 423990,2020-08-14 08:00:00,Phone,Nonformal,,1. Employees are exposed to health hazards associated with COVID-19. It was reported that face coverings are not worn and social distancing is not implemented in accordance with CDC guidelines. Contrary to Section 5(a)1 of the OSH Act.,1 /100
214500,C-1594036,Amazon Fulfillment Center - EWR8,,698 US 46,,TETERBORO,NJ,07608,BERGEN,492110 / 492110,2020-05-21 11:00:00,Email,Nonformal,,Employees are potentially exposed to health hazards from COVID-19: 1. Where the employer is not enforcing the use of masks and/or face coverings among employees. [1910.134] 2. Where the employer is not enforcing social distancing measures in the workplace. [OSH Act Section 5(a)(1)] 3. Where the employer does not provide an adequate amount of cleaning supplies for sanitizing work areas. [OSH Act Section 5(a)(1)] 4. Where employees are unable to report COVID-19 infections through the employer's reporting system. [OSH Act Section 5(a)(1)] 5. Where employees have not been adequately trained to understand the COVID-19 infection notification system.,4 /4500
215600,C-1654644,Amazon,,1 Bulova Ave,,WOODSIDE,NY,11377,QUEENS,425110 / 425110,2020-09-02 12:00:00,Email,Nonformal,,"1. Support beam column in trailer parking area has damaged bollards. 2. There is no warning sign in the boiler room where there may be asbestos present. 3. There may be live wiring on the outside walls and on the bay entrance gate next to U-haul. 4. Carts being used have wire spokes sticking out. Some of the carts are working without proper brakes. 5. Multiple roof water leaks expose employees to tripping/slipping hazards. 6. Unauthorized people have access to the electrical room. 7. Fire extinguishers were not inspected, maintained, and tested. 8. Employees are exposed to tripping hazard from extension cords in common walkways. 9. Employees are not following Covid-19 policies, such as but not limited to, wearing masks and social distancing. 10. Employees who were confirmed with Covid-19 positive did not get properly quarantined.",10 /130
215600,C-1719158,Amazon Inc.,,41 Seaver Way,Tent #ZYY1,CORONA,NY,11368,QUEENS,454111 / 454111,2021-01-13 08:00:00,Online,Nonformal,,Complainant alleges: 1) Social distancing is not maintained within the work site 2) Employees are not provided general safety training,2 /17
316700,C-1569204,Amazon Fulfillment Center,,675 Allen Road,,CARLISLE,PA,17015,CUMBERLAND,493110 / 493110,2020-04-10 08:00:00,Online,Nonformal,,The employer has not communicated to employees that they may have been exposed to covid-19. Refer to the Centers for Disease Control CDC guidance for employers at this link. https://www.cdc.gov/coronavirus/2019-ncov/community/organizations/businesses-employers.html OSHA in coordination with the Department of Health and Human Services has prepared Guidance on Preparing Workplaces for COVID-19. It can be found here: https://www.osha.gov/Publications/OSHA3990.pdf ,1 /500
316700,C-1625458,"Amazon.com, Inc. #PHL4 Fulfillment Center",,21 Roadway Drive,,CARLISLE,PA,17015,CUMBERLAND,493110 / 493110,2020-07-20 08:45:00,Online,Nonformal,,1. Employees are not wearing their face coverings correctly. They are not covering their nose and mouth. Management is not enforcing proper mask wearing and social distancing. Refer to the Centers for Disease Control CDC guidance for employers at this link. https://www.cdc.gov/coronavirus/2019-ncov/community/organizations/businesses-employers.html OSHA in coordination with the Department of Health and Human Services has prepared Guidance on Preparing Workplaces for COVID-19. It can be found here: https://www.osha.gov/Publications/OSHA3990.pdf OSHA has Guidance on Returning to Work https://www.osha.gov/Publications/OSHA4045.pdf ,1 /500
316700,C-1651795,Amazon,,21 Roadway Dr,,CARLISLE,PA,17015,CUMBERLAND,493110 / 493110,2020-08-27 18:13:00,Phone,Nonformal,,"The employer has not implemented good infection control housekeeping practices of regularly cleaning and disinfecting surfaces, including doors and turnstiles, and other elements of the work environment. Refer to the Centers for Disease Control CDC guidance for employers at this link. https://www.cdc.gov/coronavirus/2019-ncov/community/organizations/businesses-employers.html OSHA in coordination with the Department of Health and Human Services has prepared Guidance on Preparing Workplaces for COVID-19. It can be found here: https://www.osha.gov/Publications/OSHA3990.pdf OSHA has Guidance on Returning to Work https://www.osha.gov/Publications/OSHA4045.pdf ",1 /450
316700,C-1677459,Amazon Fulfillment Center,,1002 Patriot Parkway,,READING,PA,19605,BERKS,452910 / 452910,2020-10-13 08:00:00,Online,Nonformal,,"1. Covid 19 spread measures are posted everywhere but not enforced by management. 2. Employees are exposed to struck by and puncture hazards due to skids with nails protruding from the wood. 3. The employer has not implemented good infection control housekeeping practices of regularly cleaning and disinfecting surfaces, equipment, and other elements of the work environment. Refer to the Centers for Disease Control CDC guidance for employers at this link. https://www.cdc.gov/coronavirus/2019-ncov/community/organizations/businesses-employers.html OSHA in coordination with the Department of Health and Human Services has prepared Guidance on Preparing Workplaces for COVID-19. It can be found here: https://www.osha.gov/Publications/OSHA3990.pdf OSHA has Guidance on Returning to Work https://www.osha.gov/Publications/OSHA4045.pdf",3 /200
317300,C-1582359,Amazon Services LLC,"Amazon Fulfillment Service,Inc.",560 Merrimac Ave.,,MIDDLETOWN,DE,19709,NEW CASTLE,493110 / 493110,2020-05-04 08:00:00,Online,Formal,,1 - Company is not completing COVID-19 checks prior to employees entering the facility 2 - Facility is not being sanitized during the COVID-19 outbreak,/
317500,C-1624787,Amazon Pitt 5,,2250 Poswell Avenue,,PITTSBURGH,PA,15205,ALLEGHENY,492110 / 492110,2020-07-17 14:30:00,Phone,Nonformal,,"1. An employee working in the non con department vomited into a customers Rubbermaid trash can (on Tuesday July 14, 2020) and fellow employees were exposed to potential covid 19 when this employee vomited. On Thursday July 16,2020 an employee in this department was found to be positive for covid 19. The Rubbermaid trash can was partially cleaned but never sanitized and fellow employees had to handle this Rubbermaid trash can for delivery to the customer.",1 /1
317700,C-1564239,"Amazon, Inc.",,550 Oak Ridge Road,,HAZLETON,PA,18201,LUZERNE,493110 / 493110,2020-04-02 09:00:00,Online,Nonformal,,"1. Employees have tested positive for COVID-19, and the facility is not being sanitized to protect the remaining employees. 2. Due to the type of work, employees cannot maintain social distancing while accomplishing their work.",2 /500
317700,C-1571639,Amazon Fulfillment Center,,550 OAK RIDGE ROAD,,HAZLETON,PA,18202,LUZERNE,493110 / 493110,2020-04-15 09:30:00,Phone,Nonformal,,"1. The employer is requiring employees that are working in the warehouse to wear N95 respirators without a medical surveillance, fit testing, or training.",1 /25
352420,C-1572752,Amazon Prime LLC,,833 Wayne Avenue,,SILVER SPRING,MD,20910,MONTGOMERY,445110 / 445110,2020-04-14 14:00:00,Email,Nonformal,,Possibly employees are exposed to COVID-19 where personal protective equipment (PPE) was not provided. Possibly employees are exposed to COVID-19 where chemicals used for disinfecting was not provided.,2 /100
352420,C-1574622,Amazon Logistics Warehouse,,7458 New Ridge Road,,HANOVER,MD,21076,ANNE ARUNDEL,493110 / 493110,2020-04-20 15:00:00,Online,Nonformal,,"Possibly employees are exposed to COVID-19 where engineering, administrative, and work practice controls are not implemented to protect employees. Possibly employees are exposed to COVID-19 where personal protective equipment (PPE) was not provided. Possibly employees are exposed to COVID-19 where chemicals used for disinfecting was not provided.",3 /50
352420,C-1587412,Amazon,,600 Principio Pkwy W,,NORTH EAST,MD,21901,CECIL,452910 / 452910,2020-05-11 08:15:00,Online,Nonformal,,Employees possibly exposed to COVID-19 where disinfecting chemicals were not provided for the cleaning of fall protection harnesses. Employees possibly exposed to fall hazards as a result of an inadequate supply fall protection harnesses when operating the order pickers. Employees possibly exposed to unsanitary equipment as a result of blood and urine being observed on fall protection harnesses shared by employees. Employees possibly exposed to fall hazards as a result of laundering fall protection harnesses with a method that was not approved by the manufacturer.,4 /50
355114,C-1569175,Amazon Logistics,,5716 Industrial Drive,,SPRINGFIELD,VA,22151,FAIRFAX,423990 / 423990,2020-04-10 06:30:00,Phone,Nonformal,,The employer is not Implementing precautions to protect employees from contracting and spreading the Coronavirus (COVID-19) in the workplace. Possible confirmed case of COVID-19 at workplace.,1 /100
355121,C-1564731,"Amazon, LLC","Amazon Sortation Center, RIC 5",11600 North Lakeridge Parkway,,ASHLAND,VA,23005,HANOVER,454110 / 454110,2020-04-03 09:37:00,Mail,Nonformal,,"The employer is not implementing precautions to protect employees from contracting and spreading the Coronavirus (COVID-19) in the workplace: a.) The employer is not enforcing the 6 feet social distancing guidelines for employees throughout the facility including, but not limited to, the sorting employees working on lanes A, B, C, D, and E. b.) The employer is not providing additional cleaning and sanitizing for frequently touched surfaces, such as door handles, table and counter tops, vending machine buttons and scanners. ",2 /100
355121,C-1587598,Amazon Fulfillment Center,Amazon RIC 2 Chester Facility,1901 Meadowville Technology Parkway,,CHESTER,VA,23836,CHESTERFIELD,454113 / 454113,2020-05-08 10:00:00,Online,Nonformal,,The employer is not implementing precautions to protect employees from contracting and spreading the Coronavirus (COVID-19) in the workplace: 1) The employer has gatherings of 10 or more employees and is not practicing social distancing. 2) The employer is not ensuring sanitation and cleaning of frequently touched surfaces. ,2 /1
355121,C-1610119,Amazon Fulfillment Center - RIC1,,5000 Commerce Way,,PETERSBURG,VA,23803,PETERSBURG CITY,454113 / 454113,2020-06-22 08:19:00,Online,Nonformal,,The employer is not implementing precautions to protect employees from contracting and spreading the Coronavirus (COVID-19) in the workplace: a.) Additional cleaning and sanitizing of frequently touched surfaces is not being performed. ,1 /1
